,id,title,time,url,score,descendants,author,labels
481,38545205,Hands-on with Gemini: Interacting with multimodal AI [video],1701876936,https://www.youtube.com/watch?v=UIZAiXYceBI,19,3,obiefernandez,8
482,38548302,AWS's (De)Generative AI Blunder,1701890531,https://www.lastweekinaws.com/blog/aws-degenerative-ai-blunder/,29,13,dlgeek,4
483,38557520,Google CEO Sundar Pichai on Gemini and the Coming Age of AI,1701963435,https://www.technologyreview.com/2023/12/06/1084539/google-ceo-sundar-pichai-on-gemini-and-the-coming-age-of-ai/,7,3,srameshc,8
484,38541982,When Kodak Accidentally Discovered A-Bomb Testing (2016),1701855227,https://www.popularmechanics.com/science/energy/a21382/how-kodak-accidentally-discovered-radioactive-fallout/,17,0,DrZootron,0
485,38543612,Child mask mandates for Covid-19: a systematic review,1701869504,https://adc.bmj.com/content/early/2023/12/02/archdischild-2023-326215,23,36,nradov,0
486,38541272,DNS Exfiltration Tool,1701847268,https://github.com/m57/dnsteal,96,22,CodeCat,0
487,38565887,Make no mistake–AI is owned by Big Tech,1702015132,https://www.technologyreview.com/2023/12/05/1084393/make-no-mistake-ai-is-owned-by-big-tech/,5,2,cratermoon,5
488,38541516,Cdpath: Easily Navigate Directories in the Terminal,1701849792,https://www.writesoftwarewell.com/cdpath-easily-navigate-directories-in-the-terminal/,54,43,kuba-orlik,0
489,38556420,ML Ops Platform at Cloudflare,1701957822,https://blog.cloudflare.com/mlops/,10,3,todsacerdoti,0
490,38540164,Portable Executables (2020),1701833013,https://justine.lol/ape.html,9,0,linkdd,0
491,38579406,Musk's showdown with Nordic labor deepens as a pension fund dumps Tesla shares,1702105634,https://fortune.com/europe/2023/12/07/elon-musk-sweden-labor-union-tesla-court-pension-fund/,4,0,croes,6
492,38577866,Google admits the Gemini AI demo hands-on video was staged,1702089046,https://www.tomshardware.com/news/google-gemini-ai-video-staged,4,1,mgh2,8
493,38577021,"Tesla Cybertruck's stiff structure, sharp design raise safety concerns",1702082895,https://www.reuters.com/business/autos-transportation/tesla-cybertrucks-stiff-structure-sharp-design-raise-safety-concerns-experts-2023-12-08/,73,107,dev_tty01,6
494,38560705,Car & Trucker Union in Finland joins Tesla strike,1701977355,https://www.svt.se/nyheter/utrikes/finland-dras-med-i-teslastrejken--wukbot,6,1,Zolomon,6
495,38538123,Governor of Amazonas wants to charge Amazon royalties for use of the brand,1701817065,https://www.nordinvestimentos.com.br/blog/governador-do-amazonas/,87,68,khalilsautchuk,0
496,38539741,New in Chrome 120 back button detection,1701828834,https://developer.chrome.com/blog/new-in-chrome-120,48,26,clementmas,3
497,38547280,Google's Gemini: MIT Technology Review,1701885363,https://www.technologyreview.com/2023/12/06/1084471/google-deepminds-new-gemini-model-looks-amazing-but-could-signal-peak-ai-hype/,14,1,mtrofficus,8
498,38556402,Can a startup do well with mediocre early employees?,1701957740,,11,29,asilia,0
